"id","code","name"
"l10n_hr_nkd_0111","0111","Uzgoj žitarica (osim riže), mahunarki i uljanog sjemenja"
"l10n_hr_nkd_0112","0112","Uzgoj riže"
"l10n_hr_nkd_0113","0113","Uzgoj povrća, dinja i lubenica, korjenastog i gomoljastog povrća"
"l10n_hr_nkd_0114","0114","Uzgoj šećerne trske"
"l10n_hr_nkd_0115","0115","Uzgoj duhana"
"l10n_hr_nkd_0116","0116","Uzgoj predivog bilja "
"l10n_hr_nkd_0119","0119","Uzgoj ostalih jednogodišnjih usjeva "
"l10n_hr_nkd_0121","0121","Uzgoj grožđa "
"l10n_hr_nkd_0122","0122","Uzgoj tropskog i suptropskog voća"
"l10n_hr_nkd_0123","0123","Uzgoj agruma"
"l10n_hr_nkd_0124","0124","Uzgoj jezgričavog i koštuničavog voća"
"l10n_hr_nkd_0125","0125","Uzgoj bobičastog, orašastog i ostalog voća "
"l10n_hr_nkd_0126","0126","Uzgoj uljanih plodova"
"l10n_hr_nkd_0127","0127","Uzgoj usjeva za pripremanje napitaka"
"l10n_hr_nkd_0128","0128","Uzgoj bilja za uporabu u farmaciji, aromatskog, začinskog i ljekovitog bilja "
"l10n_hr_nkd_0129","0129","Uzgoj ostalih višegodišnjih usjeva "
"l10n_hr_nkd_0130","0130","Uzgoj sadnog materijala i ukrasnog bilja"
"l10n_hr_nkd_0141","0141","Uzgoj muznih krava"
"l10n_hr_nkd_0142","0142","Uzgoj ostalih goveda i bivola"
"l10n_hr_nkd_0143","0143","Uzgoj konja, magaraca, mula i mazgi"
"l10n_hr_nkd_0144","0144","Uzgoj deva i ljama"
"l10n_hr_nkd_0145","0145","Uzgoj ovaca i koza"
"l10n_hr_nkd_0146","0146","Uzgoj svinja"
"l10n_hr_nkd_0147","0147","Uzgoj peradi"
"l10n_hr_nkd_0149","0149","Uzgoj ostalih životinja"
"l10n_hr_nkd_0150","0150","Mješovita proizvodnja"
"l10n_hr_nkd_0161","0161","Pomoćne djelatnosti za uzgoj usjeva"
"l10n_hr_nkd_0162","0162","Pomoćne djelatnosti za uzgoj životinja"
"l10n_hr_nkd_0163","0163","Djelatnosti koje se obavljaju nakon žetve usjeva (priprema usjeva za primarna tržišta)"
"l10n_hr_nkd_0164","0164","Dorada sjemena za sjemenski materijal"
"l10n_hr_nkd_0170","0170","Lov, stupičarenje i uslužne djelatnosti povezane s njima"
"l10n_hr_nkd_0210","0210","Uzgoj šuma i ostale djelatnosti u šumarstvu povezane s njime"
"l10n_hr_nkd_0220","0220","Sječa drva "
"l10n_hr_nkd_0230","0230","Skupljanje šumskih plodova i proizvoda, osim šumskih sortimenata"
"l10n_hr_nkd_0240","0240","Pomoćne usluge u šumarstvu"
"l10n_hr_nkd_0311","0311","Morski ribolov"
"l10n_hr_nkd_0312","0312","Slatkovodni ribolov"
"l10n_hr_nkd_0321","0321","Morska akvakultura"
"l10n_hr_nkd_0322","0322","Slatkovodna akvakultura"
"l10n_hr_nkd_0510","0510","Vađenje kamenog ugljena"
"l10n_hr_nkd_0520","0520","Vađenje lignita"
"l10n_hr_nkd_0610","0610","Vađenje sirove nafte "
"l10n_hr_nkd_0620","0620","Vađenje prirodnog plina"
"l10n_hr_nkd_0710","0710","Vađenje željeznih ruda"
"l10n_hr_nkd_0721","0721","Vađenje uranovih i torijevih ruda"
"l10n_hr_nkd_0729","0729","Vađenje ostalih ruda obojenih metala"
"l10n_hr_nkd_0811","0811","Vađenje ukrasnoga kamena i kamena za gradnju, vapnenca, gipsa, krede i škriljevca"
"l10n_hr_nkd_0812","0812","Djelatnosti šljunčara i pješčara; vađenje gline i kaolina"
"l10n_hr_nkd_0891","0891","Vađenje minerala za kemikalije i gnojiva"
"l10n_hr_nkd_0892","0892","Vađenje treseta"
"l10n_hr_nkd_0893","0893","Vađenje soli"
"l10n_hr_nkd_0899","0899","Vađenje ostalih ruda i kamena, d. n."
"l10n_hr_nkd_0910","0910","Pomoćne djelatnosti za vađenje nafte i prirodnog plina"
"l10n_hr_nkd_0990","0990","Pomoćne djelatnosti za ostalo rudarstvo i vađenje"
"l10n_hr_nkd_1011","1011","Prerada i konzerviranje mesa"
"l10n_hr_nkd_1012","1012","Prerada i konzerviranje mesa peradi"
"l10n_hr_nkd_1013","1013","Proizvodnja proizvoda od mesa i mesa peradi"
"l10n_hr_nkd_1020","1020","Prerada i konzerviranje riba, rakova i školjki "
"l10n_hr_nkd_1031","1031","Prerada i konzerviranje krumpira"
"l10n_hr_nkd_1032","1032","Proizvodnja sokova od voća i povrća"
"l10n_hr_nkd_1039","1039","Ostala prerada i konzerviranje voća i povrća"
"l10n_hr_nkd_1041","1041","Proizvodnja ulja i masti"
"l10n_hr_nkd_1042","1042","Proizvodnja margarina i sličnih jestivih masti"
"l10n_hr_nkd_1051","1051","Djelatnosti mljekara i proizvođača sira"
"l10n_hr_nkd_1052","1052","Proizvodnja sladoleda"
"l10n_hr_nkd_1061","1061","Proizvodnja mlinskih proizvoda"
"l10n_hr_nkd_1062","1062","Proizvodnja škroba i škrobnih proizvoda"
"l10n_hr_nkd_1071","1071","Proizvodnja kruha; proizvodnja svježih peciva, slastičarskih proizvoda i kolača"
"l10n_hr_nkd_1072","1072","Proizvodnja dvopeka, keksa i srodnih proizvoda; proizvodnja trajnih peciva, slastičarskih proizvoda i kolača"
"l10n_hr_nkd_1073","1073","Proizvodnja makarona, njoka, kuskusa i slične tjestenine"
"l10n_hr_nkd_1081","1081","Proizvodnja šećera"
"l10n_hr_nkd_1082","1082","Proizvodnja kakao, čokoladnih i bombonskih proizvoda"
"l10n_hr_nkd_1083","1083","Prerada čaja i kave"
"l10n_hr_nkd_1084","1084","Proizvodnja začina i drugih dodataka hrani"
"l10n_hr_nkd_1085","1085","Proizvodnja gotove hrane i jela"
"l10n_hr_nkd_1086","1086","Proizvodnja homogeniziranih prehrambenih pripravaka i dijetetske hrane"
"l10n_hr_nkd_1089","1089","Proizvodnja ostalih prehrambenih proizvoda, d. n. "
"l10n_hr_nkd_1091","1091","Proizvodnja pripremljene stočne hrane"
"l10n_hr_nkd_1092","1092","Proizvodnja pripremljene hrane za kućne ljubimce"
"l10n_hr_nkd_1101","1101","Destiliranje, pročišćavanje i miješanje alkoholnih pića"
"l10n_hr_nkd_1102","1102","Proizvodnja vina od grožđa"
"l10n_hr_nkd_1103","1103","Proizvodnja jabukovače i ostalih voćnih vina"
"l10n_hr_nkd_1104","1104","Proizvodnja ostalih nedestiliranih fermentiranih pića"
"l10n_hr_nkd_1105","1105","Proizvodnja piva"
"l10n_hr_nkd_1106","1106","Proizvodnja slada"
"l10n_hr_nkd_1107","1107","Proizvodnja osvježavajućih napitaka; proizvodnja mineralne i drugih flaširanih voda"
"l10n_hr_nkd_1200","1200","Proizvodnja duhanskih proizvoda"
"l10n_hr_nkd_1310","1310","Priprema i predenje tekstilnih vlakana"
"l10n_hr_nkd_1320","1320","Tkanje tekstila"
"l10n_hr_nkd_1330","1330","Dovršavanje tekstila"
"l10n_hr_nkd_1391","1391","Proizvodnja pletenih i kukičanih tkanina"
"l10n_hr_nkd_1392","1392","Proizvodnja gotovih tekstilnih proizvoda, osim odjeće"
"l10n_hr_nkd_1393","1393","Proizvodnja tepiha i sagova "
"l10n_hr_nkd_1394","1394","Proizvodnja užadi, konopaca, upletenoga konca i mreža"
"l10n_hr_nkd_1395","1395","Proizvodnja netkanog tekstila i proizvoda od netkanog tekstila, osim odjeće"
"l10n_hr_nkd_1396","1396","Proizvodnja ostaloga tehničkog i industrijskog tekstila"
"l10n_hr_nkd_1399","1399","Proizvodnja ostalog tekstila, d. n."
"l10n_hr_nkd_1411","1411","Proizvodnja kožne odjeće"
"l10n_hr_nkd_1412","1412","Proizvodnja radne odjeće "
"l10n_hr_nkd_1413","1413","Proizvodnja ostale vanjske odjeće"
"l10n_hr_nkd_1414","1414","Proizvodnja rublja"
"l10n_hr_nkd_1419","1419","Proizvodnja ostale odjeće i pribora za odjeću "
"l10n_hr_nkd_1420","1420","Proizvodnja proizvoda od krzna"
"l10n_hr_nkd_1431","1431","Proizvodnja pletenih i kukičanih čarapa"
"l10n_hr_nkd_1439","1439","Proizvodnja ostale pletene i kukičane odjeće"
"l10n_hr_nkd_1511","1511","Štavljenje i obrada kože; dorada i bojenje krzna"
"l10n_hr_nkd_1512","1512","Proizvodnja putnih i ručnih torba i slično, sedlarskih i remenarskih proizvoda"
"l10n_hr_nkd_1520","1520","Proizvodnja obuće"
"l10n_hr_nkd_1610","1610","Piljenje i blanjanje drva"
"l10n_hr_nkd_1621","1621","Proizvodnja furnira i ostalih ploča od drva"
"l10n_hr_nkd_1622","1622","Proizvodnja sastavljenog parketa"
"l10n_hr_nkd_1623","1623","Proizvodnja ostale građevne stolarije i elemenata"
"l10n_hr_nkd_1624","1624","Proizvodnja ambalaže od drva"
"l10n_hr_nkd_1629","1629","Proizvodnja ostalih proizvoda od drva, proizvoda od pluta, slame i pletarskih materijala"
"l10n_hr_nkd_1711","1711","Proizvodnja celuloze"
"l10n_hr_nkd_1712","1712","Proizvodnja papira i kartona"
"l10n_hr_nkd_1721","1721","Proizvodnja valovitog papira i kartona te ambalaže od papira i kartona"
"l10n_hr_nkd_1722","1722","Proizvodnja robe za kućanstvo i higijenu te toaletnih potrepština od papira"
"l10n_hr_nkd_1723","1723","Proizvodnja uredskog materijala od papira"
"l10n_hr_nkd_1724","1724","Proizvodnja zidnih tapeta"
"l10n_hr_nkd_1729","1729","Proizvodnja ostalih proizvoda od papira i kartona"
"l10n_hr_nkd_1811","1811","Tiskanje novina"
"l10n_hr_nkd_1812","1812","Ostalo tiskanje "
"l10n_hr_nkd_1813","1813","Usluge pripreme za tisak i objavljivanje"
"l10n_hr_nkd_1814","1814","Knjigoveške i srodne usluge "
"l10n_hr_nkd_1820","1820","Umnožavanje snimljenih zapisa"
"l10n_hr_nkd_1910","1910","Proizvodnja proizvoda koksnih peći"
"l10n_hr_nkd_1920","1920","Proizvodnja rafiniranih naftnih proizvoda"
"l10n_hr_nkd_2011","2011","Proizvodnja industrijskih plinova"
"l10n_hr_nkd_2012","2012","Proizvodnja koloranata i pigmenata"
"l10n_hr_nkd_2013","2013","Proizvodnja ostalih anorganskih osnovnih kemikalija"
"l10n_hr_nkd_2014","2014","Proizvodnja ostalih organskih osnovnih kemikalija"
"l10n_hr_nkd_2015","2015","Proizvodnja gnojiva i dušičnih spojeva"
"l10n_hr_nkd_2016","2016","Proizvodnja plastike u primarnim oblicima"
"l10n_hr_nkd_2017","2017","Proizvodnja sintetičkoga kaučuka u primarnim oblicima"
"l10n_hr_nkd_2020","2020","Proizvodnja pesticida i drugih agrokemijskih proizvoda"
"l10n_hr_nkd_2030","2030","Proizvodnja boja, lakova i sličnih premaza, grafičkih boja i kitova"
"l10n_hr_nkd_2041","2041","Proizvodnja sapuna i deterdženata, sredstava za čišćenje i poliranje"
"l10n_hr_nkd_2042","2042","Proizvodnja parfema i toaletno-kozmetičkih preparata"
"l10n_hr_nkd_2051","2051","Proizvodnja eksploziva"
"l10n_hr_nkd_2052","2052","Proizvodnja ljepila "
"l10n_hr_nkd_2053","2053","Proizvodnja eteričnih ulja"
"l10n_hr_nkd_2059","2059","Proizvodnja ostalih kemijskih proizvoda, d. n. "
"l10n_hr_nkd_2060","2060","Proizvodnja umjetnih vlakana"
"l10n_hr_nkd_2110","2110","Proizvodnja osnovnih farmaceutskih proizvoda"
"l10n_hr_nkd_2120","2120","Proizvodnja farmaceutskih pripravaka"
"l10n_hr_nkd_2211","2211","Proizvodnja vanjskih i unutrašnjih guma za vozila; protektiranje vanjskih guma"
"l10n_hr_nkd_2219","2219","Proizvodnja ostalih proizvoda od gume"
"l10n_hr_nkd_2221","2221","Proizvodnja ploča, listova, cijevi i profila od plastike"
"l10n_hr_nkd_2222","2222","Proizvodnja ambalaže od plastike"
"l10n_hr_nkd_2223","2223","Proizvodnja proizvoda od plastike za građevinarstvo"
"l10n_hr_nkd_2229","2229","Proizvodnja ostalih proizvoda od plastike"
"l10n_hr_nkd_2311","2311","Proizvodnja ravnog stakla"
"l10n_hr_nkd_2312","2312","Oblikovanje i obrada ravnog stakla"
"l10n_hr_nkd_2313","2313","Proizvodnja šupljeg stakla"
"l10n_hr_nkd_2314","2314","Proizvodnja staklenih vlakana"
"l10n_hr_nkd_2319","2319","Proizvodnja i obrada ostalog stakla uključujući tehničku robu od stakla"
"l10n_hr_nkd_2320","2320","Proizvodnja vatrostalnih proizvoda"
"l10n_hr_nkd_2331","2331","Proizvodnja keramičkih pločica i ploča"
"l10n_hr_nkd_2332","2332","Proizvodnja opeke, crijepa i ostalih proizvoda od pečene gline za građevinarstvo"
"l10n_hr_nkd_2341","2341","Proizvodnja keramičkih proizvoda za kućanstvo i ukrasnih predmeta"
"l10n_hr_nkd_2342","2342","Proizvodnja sanitarne keramike "
"l10n_hr_nkd_2343","2343","Proizvodnja keramičkih izolatora i izolacijskog pribora"
"l10n_hr_nkd_2344","2344","Proizvodnja ostalih tehničkih proizvoda od keramike"
"l10n_hr_nkd_2349","2349","Proizvodnja ostalih proizvoda od keramike"
"l10n_hr_nkd_2351","2351","Proizvodnja cementa"
"l10n_hr_nkd_2352","2352","Proizvodnja vapna i gipsa "
"l10n_hr_nkd_2361","2361","Proizvodnja proizvoda od betona za građevinarstvo"
"l10n_hr_nkd_2362","2362","Proizvodnja proizvoda od gipsa za građevinarstvo"
"l10n_hr_nkd_2363","2363","Proizvodnja gotove betonske smjese"
"l10n_hr_nkd_2364","2364","Proizvodnja žbuke"
"l10n_hr_nkd_2365","2365","Proizvodnja fibro-cementa"
"l10n_hr_nkd_2369","2369","Proizvodnja ostalih proizvoda od betona, cementa i gipsa "
"l10n_hr_nkd_2370","2370","Rezanje, oblikovanje i obrada kamena"
"l10n_hr_nkd_2391","2391","Proizvodnja brusnih proizvoda"
"l10n_hr_nkd_2399","2399","Proizvodnja ostalih nemetalnih mineralnih proizvoda, d. n."
"l10n_hr_nkd_2410","2410","Proizvodnja sirovog željeza, čelika i ferolegura"
"l10n_hr_nkd_2420","2420","Proizvodnja čeličnih cijevi i pribora"
"l10n_hr_nkd_2431","2431","Hladno vučenje šipki"
"l10n_hr_nkd_2432","2432","Hladno valjanje uskih vrpci"
"l10n_hr_nkd_2433","2433","Hladno oblikovanje i profiliranje "
"l10n_hr_nkd_2434","2434","Hladno vučenje žice"
"l10n_hr_nkd_2441","2441","Proizvodnja plemenitih metala"
"l10n_hr_nkd_2442","2442","Proizvodnja aluminija"
"l10n_hr_nkd_2443","2443","Proizvodnja olova, cinka i kositra"
"l10n_hr_nkd_2444","2444","Proizvodnja bakra"
"l10n_hr_nkd_2445","2445","Proizvodnja ostalih obojenih metala"
"l10n_hr_nkd_2446","2446","Obrada nuklearnoga goriva"
"l10n_hr_nkd_2451","2451","Lijevanje željeza"
"l10n_hr_nkd_2452","2452","Lijevanje čelika"
"l10n_hr_nkd_2453","2453","Lijevanje lakih metala"
"l10n_hr_nkd_2454","2454","Lijevanje ostalih obojenih metala"
"l10n_hr_nkd_2511","2511","Proizvodnja metalnih konstrukcija i njihovih dijelova"
"l10n_hr_nkd_2512","2512","Proizvodnja vrata i prozora od metala"
"l10n_hr_nkd_2521","2521","Proizvodnja radijatora i kotlova za centralno grijanje"
"l10n_hr_nkd_2529","2529","Proizvodnja ostalih metalnih cisterni, rezervoara i sličnih posuda "
"l10n_hr_nkd_2530","2530","Proizvodnja parnih kotlova, osim kotlova za centralno grijanje toplom vodom"
"l10n_hr_nkd_2540","2540","Proizvodnja oružja i streljiva"
"l10n_hr_nkd_2550","2550","Kovanje, prešanje, štancanje i valjanje metala; metalurgija praha"
"l10n_hr_nkd_2561","2561","Obrada i prevlačenje metala"
"l10n_hr_nkd_2562","2562","Strojna obrada metala"
"l10n_hr_nkd_2571","2571","Proizvodnja sječiva"
"l10n_hr_nkd_2572","2572","Proizvodnja brava i okova"
"l10n_hr_nkd_2573","2573","Proizvodnja alata"
"l10n_hr_nkd_2591","2591","Proizvodnja čeličnih bačava i sličnih posuda "
"l10n_hr_nkd_2592","2592","Proizvodnja ambalaže od lakih metala"
"l10n_hr_nkd_2593","2593","Proizvodnja proizvoda od žice, lanaca i opruga"
"l10n_hr_nkd_2594","2594","Proizvodnja zakovica i vijčane robe"
"l10n_hr_nkd_2599","2599","Proizvodnja ostalih gotovih proizvoda od metala, d. n."
"l10n_hr_nkd_2611","2611","Proizvodnja elektroničkih komponenata "
"l10n_hr_nkd_2612","2612","Proizvodnja punih elektroničkih ploča"
"l10n_hr_nkd_2620","2620","Proizvodnja računala i periferne opreme"
"l10n_hr_nkd_2630","2630","Proizvodnja komunikacijske opreme"
"l10n_hr_nkd_2640","2640","Proizvodnja elektroničkih uređaja za široku potrošnju"
"l10n_hr_nkd_2651","2651","Proizvodnja instrumenata i aparata za mjerenje, ispitivanje i navigaciju"
"l10n_hr_nkd_2652","2652","Proizvodnja satova "
"l10n_hr_nkd_2660","2660","Proizvodnja opreme za zračenje, elektromedicinske i elektroterapeutske opreme"
"l10n_hr_nkd_2670","2670","Proizvodnja optičkih instrumenata i fotografske opreme"
"l10n_hr_nkd_2680","2680","Proizvodnja magnetskih i optičkih medija"
"l10n_hr_nkd_2711","2711","Proizvodnja elektromotora, generatora i transformatora"
"l10n_hr_nkd_2712","2712","Proizvodnja uređaja za distribuciju i kontrolu električne energije"
"l10n_hr_nkd_2720","2720","Proizvodnja baterija i akumulatora"
"l10n_hr_nkd_2731","2731","Proizvodnja kablova od optičkih vlakana"
"l10n_hr_nkd_2732","2732","Proizvodnja ostalih elektroničkih i električnih žica i kablova"
"l10n_hr_nkd_2733","2733","Proizvodnja elektroinstalacijskog materijala"
"l10n_hr_nkd_2740","2740","Proizvodnja električne opreme za rasvjetu"
"l10n_hr_nkd_2751","2751","Proizvodnja električnih aparata za kućanstvo"
"l10n_hr_nkd_2752","2752","Proizvodnja neelektričnih aparata za kućanstvo"
"l10n_hr_nkd_2790","2790","Proizvodnja ostale električne opreme"
"l10n_hr_nkd_2811","2811","Proizvodnja motora i turbina, osim motora za zrakoplove i motorna vozila"
"l10n_hr_nkd_2812","2812","Proizvodnja hidrauličnih pogonskih uređaja"
"l10n_hr_nkd_2813","2813","Proizvodnja ostalih crpki i kompresora"
"l10n_hr_nkd_2814","2814","Proizvodnja ostalih slavina i ventila"
"l10n_hr_nkd_2815","2815","Proizvodnja ležajeva, prijenosnika te prijenosnih i pogonskih elemenata"
"l10n_hr_nkd_2821","2821","Proizvodnja peći i plamenika"
"l10n_hr_nkd_2822","2822","Proizvodnja uređaja za dizanje i prenošenje"
"l10n_hr_nkd_2823","2823","Proizvodnja uredskih strojeva i opreme (osim proizvodnje računala i periferne opreme)"
"l10n_hr_nkd_2824","2824","Proizvodnja mehaniziranoga ručnog alata"
"l10n_hr_nkd_2825","2825","Proizvodnja rashladne i ventilacijske opreme, osim za kućanstvo"
"l10n_hr_nkd_2829","2829","Proizvodnja ostalih strojeva za opće namjene, d. n."
"l10n_hr_nkd_2830","2830","Proizvodnja strojeva za poljoprivredu i šumarstvo"
"l10n_hr_nkd_2841","2841","Proizvodnja strojeva za obradu metala"
"l10n_hr_nkd_2849","2849","Proizvodnja ostalih alatnih strojeva"
"l10n_hr_nkd_2891","2891","Proizvodnja strojeva za metalurgiju"
"l10n_hr_nkd_2892","2892","Proizvodnja strojeva za rudnike, kamenolome i građevinarstvo"
"l10n_hr_nkd_2893","2893","Proizvodnja strojeva za industriju hrane, pića i duhana"
"l10n_hr_nkd_2894","2894","Proizvodnja strojeva za industriju tekstila, odjeće i kože"
"l10n_hr_nkd_2895","2895","Proizvodnja strojeva za industriju papira i kartona"
"l10n_hr_nkd_2896","2896","Proizvodnja strojeva za plastiku i gumu"
"l10n_hr_nkd_2899","2899","Proizvodnja ostalih strojeva za posebne namjene, d. n."
"l10n_hr_nkd_2910","2910","Proizvodnja motornih vozila"
"l10n_hr_nkd_2920","2920","Proizvodnja karoserija za motorna vozila, prikolica i poluprikolica"
"l10n_hr_nkd_2931","2931","Proizvodnja električne i elektroničke opreme za motorna vozila "
"l10n_hr_nkd_2932","2932","Proizvodnja ostalih dijelova i pribora za motorna vozila "
"l10n_hr_nkd_3011","3011","Gradnja brodova i plutajućih objekata"
"l10n_hr_nkd_3012","3012","Gradnja čamaca za razonodu i sportskih čamaca"
"l10n_hr_nkd_3020","3020","Proizvodnja željezničkih lokomotiva i tračničkih vozila"
"l10n_hr_nkd_3030","3030","Proizvodnja zrakoplova i svemirskih letjelica te srodnih prijevoznih sredstava i opreme"
"l10n_hr_nkd_3040","3040","Proizvodnja vojnih borbenih vozila"
"l10n_hr_nkd_3091","3091","Proizvodnja motocikala"
"l10n_hr_nkd_3092","3092","Proizvodnja bicikala i invalidskih kolica"
"l10n_hr_nkd_3099","3099","Proizvodnja ostalih prijevoznih sredstava, d. n. "
"l10n_hr_nkd_3101","3101","Proizvodnja namještaja za poslovne i prodajne prostore"
"l10n_hr_nkd_3102","3102","Proizvodnja kuhinjskog namještaja"
"l10n_hr_nkd_3103","3103","Proizvodnja madraca"
"l10n_hr_nkd_3109","3109","Proizvodnja ostalog namještaja"
"l10n_hr_nkd_3211","3211","Proizvodnja novca"
"l10n_hr_nkd_3212","3212","Proizvodnja nakita i srodnih proizvoda"
"l10n_hr_nkd_3213","3213","Proizvodnja imitacije nakita (bižuterije) i srodnih proizvoda"
"l10n_hr_nkd_3220","3220","Proizvodnja glazbenih instrumenata"
"l10n_hr_nkd_3230","3230","Proizvodnja sportske opreme"
"l10n_hr_nkd_3240","3240","Proizvodnja igara i igračaka"
"l10n_hr_nkd_3250","3250","Proizvodnja medicinskih i stomatoloških instrumenata i pribora"
"l10n_hr_nkd_3291","3291","Proizvodnja metla i četaka"
"l10n_hr_nkd_3299","3299","Ostala prerađivačka industrija, d. n. "
"l10n_hr_nkd_3311","3311","Popravak proizvoda od metala"
"l10n_hr_nkd_3312","3312","Popravak strojeva"
"l10n_hr_nkd_3313","3313","Popravak elektroničke i optičke opreme"
"l10n_hr_nkd_3314","3314","Popravak električne opreme"
"l10n_hr_nkd_3315","3315","Popravak i održavanje brodova i čamaca"
"l10n_hr_nkd_3316","3316","Popravak i održavanje zrakoplova i svemirskih letjelica"
"l10n_hr_nkd_3317","3317","Popravak i održavanje ostalih prijevoznih sredstava"
"l10n_hr_nkd_3319","3319","Popravak ostale opreme"
"l10n_hr_nkd_3320","3320","Instaliranje industrijskih strojeva i opreme"
"l10n_hr_nkd_3511","3511","Proizvodnja električne energije"
"l10n_hr_nkd_3512","3512","Prijenos električne energije"
"l10n_hr_nkd_3513","3513","Distribucija električne energije"
"l10n_hr_nkd_3514","3514","Trgovina električnom energijom"
"l10n_hr_nkd_3521","3521","Proizvodnja plina"
"l10n_hr_nkd_3522","3522","Distribucija plinovitih goriva distribucijskom mrežom"
"l10n_hr_nkd_3523","3523","Trgovina plinom distribucijskom mrežom"
"l10n_hr_nkd_3530","3530","Opskrba parom i klimatizacija"
"l10n_hr_nkd_3600","3600","Skupljanje, pročišćavanje i opskrba vodom"
"l10n_hr_nkd_3700","3700","Uklanjanje otpadnih voda"
"l10n_hr_nkd_3811","3811","Skupljanje neopasnog otpada"
"l10n_hr_nkd_3812","3812","Skupljanje opasnog otpada"
"l10n_hr_nkd_3821","3821","Obrada i zbrinjavanje neopasnog otpada"
"l10n_hr_nkd_3822","3822","Obrada i zbrinjavanje opasnog otpada"
"l10n_hr_nkd_3831","3831","Rastavljanje olupina"
"l10n_hr_nkd_3832","3832","Oporaba posebno izdvojenih materijala"
"l10n_hr_nkd_3900","3900","Djelatnosti sanacije okoliša te ostale djelatnosti gospodarenja otpadom"
"l10n_hr_nkd_4110","4110","Organizacija izvedbe projekata za zgrade"
"l10n_hr_nkd_4120","4120","Gradnja stambenih i nestambenih zgrada"
"l10n_hr_nkd_4211","4211","Gradnja cesta i autocesta"
"l10n_hr_nkd_4212","4212","Gradnja željezničkih pruga i podzemnih željeznica"
"l10n_hr_nkd_4213","4213","Gradnja mostova i tunela"
"l10n_hr_nkd_4221","4221","Gradnja cjevovoda za tekućine i plinove"
"l10n_hr_nkd_4222","4222","Gradnja vodova za električnu struju i telekomunikacije"
"l10n_hr_nkd_4291","4291","Gradnja vodnih građevina"
"l10n_hr_nkd_4299","4299","Gradnja ostalih građevina niskogradnje, d. n."
"l10n_hr_nkd_4311","4311","Uklanjanje građevina"
"l10n_hr_nkd_4312","4312","Pripremni radovi na gradilištu"
"l10n_hr_nkd_4313","4313","Pokusno bušenje i sondiranje terena za gradnju"
"l10n_hr_nkd_4321","4321","Elektroinstalacijski radovi"
"l10n_hr_nkd_4322","4322","Uvođenje instalacija vodovoda, kanalizacije i plina i instalacija za grijanje i klimatizaciju "
"l10n_hr_nkd_4329","4329","Ostali građevinski instalacijski radovi"
"l10n_hr_nkd_4331","4331","Fasadni i štukaturski radovi"
"l10n_hr_nkd_4332","4332","Ugradnja stolarije"
"l10n_hr_nkd_4333","4333","Postavljanje podnih i zidnih obloga"
"l10n_hr_nkd_4334","4334","Soboslikarski i staklarski radovi"
"l10n_hr_nkd_4339","4339","Ostali završni građevinski radovi"
"l10n_hr_nkd_4391","4391","Radovi na krovištu"
"l10n_hr_nkd_4399","4399","Ostale specijalizirane građevinske djelatnosti, d. n."
"l10n_hr_nkd_4511","4511","Trgovina automobilima i motornim vozilima lake kategorije "
"l10n_hr_nkd_4519","4519","Trgovina ostalim motornim vozilima"
"l10n_hr_nkd_4520","4520","Održavanje i popravak motornih vozila"
"l10n_hr_nkd_4531","4531","Trgovina na veliko dijelovima i priborom za motorna vozila "
"l10n_hr_nkd_4532","4532","Trgovina na malo dijelovima i priborom za motorna vozila"
"l10n_hr_nkd_4540","4540","Trgovina motociklima, dijelovima i priborom za motocikle te održavanje i popravak motocikala"
"l10n_hr_nkd_4611","4611","Posredovanje u trgovini poljoprivrednim sirovinama, živom stokom, tekstilnim sirovinama i poluproizvodima"
"l10n_hr_nkd_4612","4612","Posredovanje u trgovini gorivima, rudama, metalima i industrijskim kemijskim proizvodima"
"l10n_hr_nkd_4613","4613","Posredovanje u trgovini drvom i građevinskim materijalom"
"l10n_hr_nkd_4614","4614","Posredovanje u trgovini strojevima, industrijskom opremom, brodovima i zrakoplovima"
"l10n_hr_nkd_4615","4615","Posredovanje u trgovini namještajem, proizvodima za kućanstvo i željeznom robom"
"l10n_hr_nkd_4616","4616","Posredovanje u trgovini tekstilom, odjećom, krznom, obućom i kožnim proizvodima"
"l10n_hr_nkd_4617","4617","Posredovanje u trgovini hranom, pićima i duhanom"
"l10n_hr_nkd_4618","4618","Posredovanje u trgovini specijaliziranoj za određene proizvode"
"l10n_hr_nkd_4619","4619","Posredovanje u trgovini raznovrsnim proizvodima"
"l10n_hr_nkd_4621","4621","Trgovina na veliko žitaricama, sirovim duhanom, sjemenjem i stočnom hranom"
"l10n_hr_nkd_4622","4622","Trgovina na veliko cvijećem i sadnicama"
"l10n_hr_nkd_4623","4623","Trgovina na veliko živom stokom"
"l10n_hr_nkd_4624","4624","Trgovina na veliko sirovim i štavljenim kožama"
"l10n_hr_nkd_4631","4631","Trgovina na veliko voćem i povrćem"
"l10n_hr_nkd_4632","4632","Trgovina na veliko mesom i mesnim proizvodima"
"l10n_hr_nkd_4633","4633","Trgovina na veliko mlijekom, mliječnim proizvodima, jajima, jestivim uljima i mastima"
"l10n_hr_nkd_4634","4634","Trgovina na veliko pićima"
"l10n_hr_nkd_4635","4635","Trgovina na veliko duhanskim proizvodima"
"l10n_hr_nkd_4636","4636","Trgovina na veliko šećerom, čokoladom i bombonima"
"l10n_hr_nkd_4637","4637","Trgovina na veliko kavom, čajem, kakaom i začinima"
"l10n_hr_nkd_4638","4638","Trgovina na veliko ostalom hranom uključujući ribe, rakove i školjke"
"l10n_hr_nkd_4639","4639","Nespecijalizirana trgovina na veliko hranom, pićima i duhanskim proizvodima"
"l10n_hr_nkd_4641","4641","Trgovina na veliko tekstilom"
"l10n_hr_nkd_4642","4642","Trgovina na veliko odjećom i obućom"
"l10n_hr_nkd_4643","4643","Trgovina na veliko električnim aparatima za kućanstvo"
"l10n_hr_nkd_4644","4644","Trgovina na veliko porculanom, staklom i sredstvima za čišćenje"
"l10n_hr_nkd_4645","4645","Trgovina na veliko parfemima i kozmetikom"
"l10n_hr_nkd_4646","4646","Trgovina na veliko farmaceutskim proizvodima"
"l10n_hr_nkd_4647","4647","Trgovina na veliko namještajem, sagovima i opremom za rasvjetu"
"l10n_hr_nkd_4648","4648","Trgovina na veliko satovima i nakitom"
"l10n_hr_nkd_4649","4649","Trgovina na veliko ostalim proizvodima za kućanstvo"
"l10n_hr_nkd_4651","4651","Trgovina na veliko računalima, perifernom opremom i softverom"
"l10n_hr_nkd_4652","4652","Trgovina na veliko elektroničkim i telekomunikacijskim dijelovima i opremom"
"l10n_hr_nkd_4661","4661","Trgovina na veliko poljoprivrednim strojevima, opremom i priborom"
"l10n_hr_nkd_4662","4662","Trgovina na veliko alatnim strojevima"
"l10n_hr_nkd_4663","4663","Trgovina na veliko strojevima za rudnike i građevinarstvo"
